Currency,Name,Price,SHOPEE_Price,SHOPEE_Ref,SHOPEE_Sold,Sold
MYR,LOVE Graffiti Art Hand Posters and Prints on Canvas Painting Fashion Street Wall Art Picture for Living Room Home Design Decor,24.19,2.68,RSS_ HEILO H254 Japan Canvas Design Tote Bag Handbag Shoulder Beg Sling Bags,958,4
MYR,Japanese Ninja Bonsa Bushido Samurai Kanji Ink Design Canvas Posters and Prints Oil Painting Wall Art Pictures Living Room Decor,60.04,2.68,RSS_ HEILO H254 Japan Canvas Design Tote Bag Handbag Shoulder Beg Sling Bags,958,1
MYR,Graffiti Abstract Art Canvas Painting Pop Girls Pictures Posters On the Wall Art Painting For Home Decoration Design,128.67,2.68,RSS_ HEILO H254 Japan Canvas Design Tote Bag Handbag Shoulder Beg Sling Bags,958,2
MYR,Jil Sander Canvas Bag Spliced Simple Casual Tote Bags Large Capacity Shoulder Shopping Bag Niche Designer Brand Handbag,226.8,2.68,RSS_ HEILO H254 Japan Canvas Design Tote Bag Handbag Shoulder Beg Sling Bags,958,2
MYR,"Design with Elements of Ancient Egyptian History Illustration Pattern, Posters and Print Canvas Wall Art Home Decorative",17.33,2.68,RSS_ HEILO H254 Japan Canvas Design Tote Bag Handbag Shoulder Beg Sling Bags,958,1
MYR,Trendy Boho Abstract Tropcial Plants Geometric Design Canvas Painting Poster Prints Wall Art Pictures for Living Room Home Decor,22.5,2.68,RSS_ HEILO H254 Japan Canvas Design Tote Bag Handbag Shoulder Beg Sling Bags,958,11
MYR,TIE LER Fighter Design Diagram Kitchen Posters Living Room Bar Cafe Bedroom Adornment Retro Poster Wall Stickers 51.5x36cm,1.27,2.68,RSS_ HEILO H254 Japan Canvas Design Tote Bag Handbag Shoulder Beg Sling Bags,958,53
MYR,Canvas Women's Shoulder Bag Large Capacity Shopper Designer Handbags for Women Simple School Tote Female Crossbody Messenger Bag,68.02,2.68,RSS_ HEILO H254 Japan Canvas Design Tote Bag Handbag Shoulder Beg Sling Bags,958,4
MYR,Tupac Shakur 2PAC Canvas Painting Rapper Star Poster Hip Hop Art Painting Moder Wall Decor Posters Wall Pictures for Home Design,32.32,2.68,RSS_ HEILO H254 Japan Canvas Design Tote Bag Handbag Shoulder Beg Sling Bags,958,4
MYR,Canvas Oil Painting Japanese Ninja Bonsa Bushido Samurai Kanji Ink Design Poster Prints Art Wall Pictures Living Room Home Decor,12.59,2.68,RSS_ HEILO H254 Japan Canvas Design Tote Bag Handbag Shoulder Beg Sling Bags,958,5
MYR,Women's Patent PU Leather High Capacity Shoulder Crossbody Bag Japan Style Jacket Shape Fashion Messenger Tote Shopping Handbags,117.27,2.68,RSS_ HEILO H254 Japan Canvas Design Tote Bag Handbag Shoulder Beg Sling Bags,958,30
MYR,TIE LER Kraft Paper Fighter Design Diagram Posters Living Room Bar Cafe Bedroom Adornment Retro Wall Stickers Decor Painting,1.27,2.68,RSS_ HEILO H254 Japan Canvas Design Tote Bag Handbag Shoulder Beg Sling Bags,958,35
MYR,TIE LER Classic Retro Fighter Design Diagram Series Kraft Paper Poster Home Decor Painting Wall Stickers,1.27,2.68,RSS_ HEILO H254 Japan Canvas Design Tote Bag Handbag Shoulder Beg Sling Bags,958,80
MYR,TIE LER Fighter Design Diagram Series Kraft Paper Poster High Quality Print Painting Poster Home Decor Wall Decoration Painting,1.27,2.68,RSS_ HEILO H254 Japan Canvas Design Tote Bag Handbag Shoulder Beg Sling Bags,958,74
MYR,Personality Custom Art Silk Canvas Poster Print,63.42,2.68,RSS_ HEILO H254 Japan Canvas Design Tote Bag Handbag Shoulder Beg Sling Bags,958,331
MYR,27 Designs Anime Monogatari Kraftpaper Poster Home Decal Art Painting Funny Wall Sticker for Coffee House Bar 2,2.82,2.68,RSS_ HEILO H254 Japan Canvas Design Tote Bag Handbag Shoulder Beg Sling Bags,958,2
MYR,Bigfoot Tours Poster Sasquatch Country Vintage Canvas Painting for Home Decor,25.93,2.68,RSS_ HEILO H254 Japan Canvas Design Tote Bag Handbag Shoulder Beg Sling Bags,958,5
MYR,Wall Vinyl Decal Art Sticker Japanese Kanji Lettering Love Health Happiness Words Removable Mural Unique Design 2250,27.25,2.68,RSS_ HEILO H254 Japan Canvas Design Tote Bag Handbag Shoulder Beg Sling Bags,958,16
MYR,Handbags for Women 2023 Designer Crochet Beach Bag Casual with Buckle Cute Tote Bags Stripes Shopper Rainbow Canvas Shoulder Bag,56.18,2.68,RSS_ HEILO H254 Japan Canvas Design Tote Bag Handbag Shoulder Beg Sling Bags,958,39
MYR,Bohemian Decor Poster Vintage Flower Leaves Text Pictures For Home Design Paint For Wall Home Decoration Posters And Prints,23.44,2.68,RSS_ HEILO H254 Japan Canvas Design Tote Bag Handbag Shoulder Beg Sling Bags,958,12
MYR,1pc Japanese Style Retro Metal Bookmark Design of Hokusai The Great Wave Off Kanagawa Pictures Tassel Book Mark Promotional Gift,13.01,2.68,RSS_ HEILO H254 Japan Canvas Design Tote Bag Handbag Shoulder Beg Sling Bags,958,44
MYR,Mount Fuji Pagoda Canvas Painting Japan Mount Fuji Landscape Poster Prints Morden Home Living Room Decoration Wall Art Painting,113.17,2.68,RSS_ HEILO H254 Japan Canvas Design Tote Bag Handbag Shoulder Beg Sling Bags,958,3
MYR,Abstract Sculpture Art of David Vaporwave Canvas Posters and Prints Funny Statue Modern Wall Paintings Pictures for Home Decor,46.41,2.68,RSS_ HEILO H254 Japan Canvas Design Tote Bag Handbag Shoulder Beg Sling Bags,958,4
MYR,Vintage Home Decoration Posters Japan Bushido Spirit Quotes Art Canvas Print Painting Black White Wall Picture for Living Room,101.8,2.68,RSS_ HEILO H254 Japan Canvas Design Tote Bag Handbag Shoulder Beg Sling Bags,958,1
MYR,Japan Hot Slam Dunk Anime Role Poster And Prints Cartoon Fashion Wall Art Canvas Painting Home Decor For Boy Kid Bedroom,83.1,2.68,RSS_ HEILO H254 Japan Canvas Design Tote Bag Handbag Shoulder Beg Sling Bags,958,1
MYR,Women's Tote Bag Striped Canvas Casual Handbags for Women 2023 Simple Shopping Large Capacity Woman Shopper School Shoulder Bag,50.45,2.68,RSS_ HEILO H254 Japan Canvas Design Tote Bag Handbag Shoulder Beg Sling Bags,958,89
MYR,Home Decorative Jojo S Bizarre Canvas HD Prints Paintings Modular Japanese Animation Role Pictures Wall Poster Artwork Framed,117.11,2.68,RSS_ HEILO H254 Japan Canvas Design Tote Bag Handbag Shoulder Beg Sling Bags,958,1
MYR,Guernica By Picasso Canvas Paintings Reproductions Famous Canvas Wall Art Posters And Prints Picasso Pictures Home Wall Decor,272.47,2.68,RSS_ HEILO H254 Japan Canvas Design Tote Bag Handbag Shoulder Beg Sling Bags,958,1
MYR,Canvas Painting Wall Art Medusa Head Blue abstract Picture Posters HD Modern Classical print Decorative Paintings,64.5,2.68,RSS_ HEILO H254 Japan Canvas Design Tote Bag Handbag Shoulder Beg Sling Bags,958,1
MYR,Tokyo City Japan Tour Travel Canvas Paintings Vintage Wall Pictures Kraft Posters Coated Wall Stickers Home Decoration Gift,91.04,2.68,RSS_ HEILO H254 Japan Canvas Design Tote Bag Handbag Shoulder Beg Sling Bags,958,1
MYR,Guernica By Picasso Canvas Paintings Reproductions Famous Canvas Wall Art Posters And Prints Picasso Pictures Home Wall Decor,74.6,2.68,RSS_ HEILO H254 Japan Canvas Design Tote Bag Handbag Shoulder Beg Sling Bags,958,1
MYR,Sanjuro Akira Kurosawa Vintage Retro Japan Film Japanese Movie Decorative Poster Wall Canvas Sticker Home Decor,21.47,2.68,RSS_ HEILO H254 Japan Canvas Design Tote Bag Handbag Shoulder Beg Sling Bags,958,2
MYR,Black and White Japan Samurai Portrait Wall Art Bushido Canvas Painting Japanese Warriors Canvas Print Posters for Living Room,42.28,2.68,RSS_ HEILO H254 Japan Canvas Design Tote Bag Handbag Shoulder Beg Sling Bags,958,6
MYR,Japan Anime Movie Poster Rusted Retro Home Tin Sign Decor Kid's Bedroom Man Cave Wall Stickers Metal Tin Plate Painting Plaques,23.25,2.68,RSS_ HEILO H254 Japan Canvas Design Tote Bag Handbag Shoulder Beg Sling Bags,958,2
MYR,Women Chain Tote Bag Designer Female Shoulder Casual Bags Beach Canvas Leisure Handbags Women's Bag 2023 Trend Medium,76.43,2.68,RSS_ HEILO H254 Japan Canvas Design Tote Bag Handbag Shoulder Beg Sling Bags,958,165
MYR,Ernest Miller Hemingway Canvas Painting Vintage Wall Pictures Kraft Posters Coated Wall Stickers Home Decoration Gift,136.23,2.68,RSS_ HEILO H254 Japan Canvas Design Tote Bag Handbag Shoulder Beg Sling Bags,958,1
MYR,Japanese Ukiyoe Scroll Canvas Poster Wall Pictures For Living Room Decor Vintage Scroll Paintings With Solid Wood Hanger,57.59,2.68,RSS_ HEILO H254 Japan Canvas Design Tote Bag Handbag Shoulder Beg Sling Bags,958,3
MYR,Botanical Canvas Prints Magnolia Flower Art Print Set Wall Art Poster Canvas Painting Picture Vintage Poster Antique Art Decor,47.92,2.68,RSS_ HEILO H254 Japan Canvas Design Tote Bag Handbag Shoulder Beg Sling Bags,958,1
MYR,Islamic Calligraphy Ayatul Kursi Blooming Floral Muslim Canvas Painting Wall Art Prints Picture Poster Living Room Home Decor,84.93,2.68,RSS_ HEILO H254 Japan Canvas Design Tote Bag Handbag Shoulder Beg Sling Bags,958,4
MYR,[ Mike86 ] Fighter japan game Tin Sign Vintage Wall Posters Metal Painting Gift art decor for Cafe LTA-1875 20*30 CM,45.57,2.68,RSS_ HEILO H254 Japan Canvas Design Tote Bag Handbag Shoulder Beg Sling Bags,958,8
